id;subject;questionType;question;completed;answers/0;answers/1;answers/2;answers/3;answers/4;answers/5;answers/6;answers/7;answers/8;answers/9;;correct/0;correct/1;correct/2;correct/3;correct/4;correct/5;correct/6;correct/7;correct/8;correct/9;;title/0;title/1;title/2;title/3;title/4;title/5;title/6;title/7;title/8;title/9;;;;
1174;Datenbanken;SC;Es besteht eine Unverträglichkeit zwischen objektorientierten Programmiersprachen und dem Konzept der relationalen Datenbanken. Diese wird als Object-Relational Impedance Mismatch bezeichnet.;false;;;;;;;;;;;;1;0;;;;;;;;;;Wahr;Falsch;;;;;;;;;;;;
1175;Datenbanken;SC;O/R Mapper...;false;... mappen Objekte auf Relationen.;...mappen objektorientierte Datenbanken auf Relationenschemata.;;;;;;;;;;1;0;;;;;;;;;;;;;;;;;;;;;;;
1176;Datenbanken;SC;SQL ist eine deskriptive Sprache.;false;;;;;;;;;;;;1;0;;;;;;;;;;Wahr;Falsch;;;;;;;;;;;;
1177;Datenbanken;SC;SQL ist eine deklarative Sprache.;false;;;;;;;;;;;;1;0;;;;;;;;;;Wahr;Falsch;;;;;;;;;;;;
1178;Datenbanken;MC;Welches Verhalten kann man für Löschoperationen und Updates festlegen?;false;Cascade;Set null;Set default;No action;;;;;;;;1;1;1;1;;;;;;;;;;;;;;;;;;;;;
1179;Datenbanken;SC;Mit welchem Schlüsselwort kann die Eindeutigkeit eines Wertes sichergestellt werden?;false;CHECK;UNIQUE;ONLY;;;;;;;;;0;1;0;;;;;;;;;;;;;;;;;;;;;;
1180;Datenbanken;MC;Bei welchen der folgenden Funktionen handelt es sich um Aggregatfunktionen?;false;PLUS;MINUS;AVG;COUNT;MAX;MIN;SUM;DIVIDE;;;;0;0;1;1;1;1;1;0;;;;;;;;;;;;;;;;;
1181;Datenbanken;MC;Alle Kundennamen (Vor- und Nachname) aus der Relation 'Kunde' sollen ausgegeben werden. Kein Kundenname soll doppelt ausgegeben werden.;false;"SELECT DISTINCT Vorname, Nachname; FROM Kunde;";"SELECT Vorname, Nachname FROM Kunde;";"SELECT DISTINCT Vorname, Nachname FROM Kunde;";;;;;;;;;0;0;0;1;;;;;;;;;;;;;;;;;;;;;
1182;Datenbanken;DD;Data Definition Language (DDL ) und Data Manipulation Language (DML): Ordne zu!;false;Create;Alter;Insert;Drop;Update;Delete;;;;;;2;2;1;2;1;1;;;;;;DML;DDL;;;;;;;;;;;;
1183;Datenbanken;SC;Beziehungen zweiten Grades werden als duale Beziehungen bezeichnet.;false;;;;;;;;;;;;0;1;;;;;;;;;;Wahr;Falsch;;;;;;;;;;;;
1184;Datenbanken;SC;Rekursive Beziehungen sind erlaubt.;false;;;;;;;;;;;;1;0;;;;;;;;;;Wahr;Falsch;;;;;;;;;;;;
1185;Datenbanken;SC;Kardinalitäten werden auch als look-around-Kardinalitäten bezeichnet.;false;;;;;;;;;;;;0;1;;;;;;;;;;Wahr;Falsch;;;;;;;;;;;;
1186;Datenbanken;SC;Die Beziehung is-a stellt eine Aggregation dar und die part-of-Beziehung eine Generalisierung.;false;;;;;;;;;;;;0;1;;;;;;;;;;Wahr;Falsch;;;;;;;;;;;;
1187;Datenbanken;SC;chwache Entitäten können nicht ohne ihre Eigentümerentität existieren.;false;;;;;;;;;;;;1;0;;;;;;;;;;Wahr;Falsch;;;;;;;;;;;;
1188;Datenbanken;OD;Bringe die Speichersysteme bezüglich Kosten/Byte und Geschwindigkeit (absteigend) sowie Zugriffszeit und Speicherkapazität (aufsteigend) in die richtige Reihenfolge.;false;main memory;register/cache;mangetic disk;optical disk;magnetic tape;flash memory;;;;;;1;4;5;6;3;;;;;;;;;;;;;;;;;;;;
1189;Datenbanken;SC;Wie werden Daten in den Hauptspeicher übertragen?;false;Blockweise;Seitenweise;Je ein Datensatz;;;;;;;;;1;0;0;;;;;;;;;;;;;;;;;;;;;;
1190;Datenbanken;MC;Welche Anomalien können auftreten?;false;Löschanomalien;Updateanomalien;Einfügeanomalien;Cascadeanomalien;;;;;;;;1;1;0;;;;;;;;;;;;;;;;;;;;;;
1191;Datenbanken;SC;Was versteht man unter einem Primärschlüssel?;false;Primärschlüssel einer Relation, der in einer anderen Relation platziert wird, um so eine Beziehung zwischen den Relationen herzustellen.;Genau ein Kandidatenschlüssel wird als diese Art von Schlüssel festgelegt.;Ein Schlüssel, der künstlich zur Relation hinzugefügt wird, um als Primärschlüssel zu fungieren.;Eine Menge von non-null Attributen, von der die gesamt Attributmenge funktional abhängig ist.;;;;;;;;0;1;0;0;;;;;;;;;;;;;;;;;;;;;
1192;Datenbanken;SC;Bei welcher Art der Datensatz-Speicherung werden Datensätze als Key-Value-Paare gespeichert?;false;Fixlängen-Speicherung;Speicherung in variabler Länge;;;;;;;;;;0;1;;;;;;;;;;;;;;;;;;;;;;;
1193;Datenbanken;SC;Wann muss auf alle Fälle die Organisationsform 'Spanned' verwendet werden?;false;bfr=100;bfr=10;bfr=1;bfr=0;;;;;;;;0;0;0;1;;;;;;;;;;;;;;;;;;;;;
1194;Datenbanken;MC;Aus welchen Operationen setzt sich die Löschoperation bei B-Bäumen zusammen?;false;Rotation;Turn ;Merge;Spin;Delete;Insert;;;;;;1;0;1;0;0;0;;;;;;;;;;;;;;;;;;;
1195;Datenbanken;SC;Die Ordnung eines B-Baumes in einem Computersystem kann nicht beliebig erhöht werden, da ein Knoten einem Block/einer Seite entspricht und Blöcke in einem Computersystem durch eine feste Größe begrenzt sind.;false;;;;;;;;;;;;1;0;;;;;;;;;;Wahr;Falsch;;;;;;;;;;;;
1196;Datenbanken;SC;Wofür steht HANA?;false;High Performance Analytic Application;High Performance Analytic Appliance;;;;;;;;;;1;0;;;;;;;;;;;;;;;;;;;;;;;
1197;Datenbanken;SC;Was unterscheidet HANA von anderen relationalen Datenbanken (Oracle, MS-SQL, etc.)?;false;HANA arbeitet spaltenorientiert, andere relationale Datenbanken arbeiten zeilenorientiert;HANA arbeitet zeilenorientiert, andere relationale Datenbanken arbeiten spaltenorientiert;;;;;;;;;;1;0;;;;;;;;;;;;;;;;;;;;;;;
1198;Datenbanken;SC;HANA ist eine In-Memory-Datenbank.;false;;;;;;;;;;;;1;0;;;;;;;;;;Wahr;Falsch ;;;;;;;;;;;;
1199;it-intro;SC;Welche Aussage trifft auf digitale Informationen zu?;false;Sie können zu geringen Kosten ohne Integritätsverlust aufwändig dupliziert werden.;Sie können in kurzer Zeit ohne Qualitätsverlust einfach dupliziert werden.;Sie können zu geringen Kosten ohne Qualitätsverlust einfach dupliziert werden.;Sie können zu geringen Kosten ohne Qualitätsverlust einfach zerstört werden.;;;;;;;;0;0;1;0;;;;;;;;;;;;;;;;;;;;;
1200;it-intro;SC;Wie ist Software am besten definiert?;false;Die Offlineversion einer Netzwerkressource.;Eine Sammlung von Algorithmen auf einem Computer.;Die Implementierung eines Programms in einer Laufzeitumgebung.;;;;;;;;;0;0;1;;;;;;;;;;;;;;;;;;;;;;
1201;it-intro;MC;Eine Softwareprodukt enthält meistens welche Bestandteile?;false;Code;Vertrag;Installations- und De-Installationsroutinen;Bilder, Klänge und Schriftarten;Hilfssystem / Anleitung;Rechnung;Diskette;Updatemethoden / Patches;Treiber für spezifische Hardware;;Aktivierungscode;1;0;1;1;1;0;0;1;1;0;;;;;;;;;;;;;;;
1202;it-intro;SC;Wie viele natürliche Zahlen existieren in einem 32bit-System?;false;32^2 - 1;2^32;32^2;2^32 - 1;;;;;;;;0;0;0;1;;;;;;;;;;;;;;;;;;;;;
1203;it-intro;SC;Was wird als Mantisse bezeichnet?;false;Die Potenz einer Gleitkommazahl nach den Ziffernstellen.;Die Ziffernstellen einer Gleitkommazahl vor der Potenz.;Der Logarithmus einer Gleitkommazahl bezogen auf die Potenz.;Die Stellen einer Gleitkommazahl vor dem Komma.;;;;;;;;0;1;0;0;;;;;;;;;;;;;;;;;;;;;
1204;it-intro;SC;Sind Gleitkommazahlen fehleranfällig?;false;Ja, die Limitierung der Mantisse führt zu Präzisionsfehlern.;Ja, aber der Gleitkommaprozessor gleicht die Fehler der Potenz aus.;Ja, aber nur bei negativen Gleitkommazahlen durch die Nullstellenproblematik.;;;;;;;;;1;0;0;;;;;;;;;;;;;;;;;;;;;;
1205;it-intro;SC;Wozu dient die Byte-Reihenfolge?;false;Sie legt fest, in welcher Reihenfolge Bytefolgen gespeichert werden.;Sie legt fest, in welcher Reihenfolge Byteabstände gelöscht werden.;Sie legt fest, in welcher Reihenfolge Bytefolgen verschlüsselt werden.;;;;;;;;;1;0;0;;;;;;;;;;;;;;;;;;;;;;
1206;it-intro;MC;Welche Elemente sind Bestandteile einer Von-Neumann-Architektur?;false;Prozessor (CPU) mit Steuerwerk und Rechenwerk (ALU);Register;Hauptspeicher;Massenspeicher;I/O-Interface;Grafikeinheit;Netzwerkeinheit;Bus-System;;;;1;0;1;0;1;0;0;1;;;;;;;;;;;;;;;;;
1207;it-intro;DD;Ordne diese typischen Operationen einer Von-Neumann-Architektur einander zu!;false;Stop;Summierung von Daten;Verschiebung von Daten zwischen Speicher, Prozessor und I/0;Vergleich von Daten;Multiplikation von Daten;Sprung zu neuer Instruktion;;;;;;4;1;3;2;1;4;;;;;;Arithmetische Operation;Logische Operation;Transportoperation;Verzweigung;;;;;;;;;;
1208;it-intro;MC;Welche Datenkompressionarten gibt es?;false;Verlustarme Datenkompression (Poor Lossless);Verlustbehaftete Datenkompression (Lossy);Verlustqualitative Datenkompression (Quality Lossy);Verlustsensitive Datenkompression (Sensitive Lossy);Verlustfreie Datenkompression (Lossless);Verlustreiche Datenkompression (Rich Lossless);;;;;;0;1;0;0;1;0;;;;;;;;;;;;;;;;;;;
1209;it-intro;SC;Was ist ein Cache;false;Die technische Bezeichnung für die Druckerwarteschlange.;Der Blockbereich eines Massenspeichers, der für die Verteilung von Prüfziffern zuständig ist.;Ein Puffer-Speicher, der zwischen Systemen mit unterschiedlicher Geschwindigkeit vermittelt.;Die Sicherheitsschaltung in einem Netzteil.;;;;;;;;0;0;1;0;;;;;;;;;;;;;;;;;;;;;
1210;it-intro;SC;Was sind zeichenorientierte Geräte (character devices)?;false;Zeichenorientierte Geräte übertragen nur ein Zeichen zur selben Zeit. Ein Beispiel ist das Keyboard.;Zeichenorientierte Geräte sind Geräte zur Freihandgestaltung am Computer. Ein Beispiel ist der PC-Stift.;Zeichenorientierte Geräte übertragen Zeichen in Matrixform. Ein Beispiel ist eine Analog-Digital-Matrix.;;;;;;;;;1;0;0;;;;;;;;;;;;;;;;;;;;;;
1211;VS;SC;Für was steht die Abkürzung PHP?;false;Private Home Page;Hypertext Preprocessor;Personal Hypertext Processor;;;;;;;;;0;1;0;;;;;;;;;;;;;;;;;;;;;;
1212;VS;SC;PHP ist eine serverseitige Programmiersprache, die HTML und CSS Code generieren kann.;false;;;;;;;;;;;;1;0;;;;;;;;;;Wahr;Falsch ;;;;;;;;;;;;
1213;VS;MC;Welche Angaben werden benötigt, um eine Socket-Verbindung zu einem Server herzustellen?;false;IP-Adresse;TCP-Portnummer;MAC-Adresse;Server-Passwort;;;;;;;;1;1;0;0;;;;;;;;;;;;;;;;;;;;;
1214;VS;SC;Anschlussströme repräsentieren eine Verbindung zu einer Quelle oder einem Zielort (Datei, Socket, usw.).;false;;;;;;;;;;;;1;0;;;;;;;;;;Wahr;Falsch;;;;;;;;;;;;
1215;VS;DD;Weise die Aussagen richtig zu!;false;Skriptsprache;von Webserver instanziiert und durchgeführt;serverseitig;vom Client geladen und ausgeführt;clientseitig;hat nichts zu tun mit Java;kann fast gesamte Java-API benutzen;;;;;1;3;2;2;1;1;2;;;;;JavaScript;Java Applet;Java Servlet;;;;;;;;;;;
1216;VS;SC;jQuery ist eine…;false;...Programmiersprache;...JSON Library;...JavaScript Library;...Art, Warteschlangen (Querys) zu organisieren;;;;;;;;0;0;1;0;;;;;;;;;;;;;;;;;;;;;
1217;VS;SC;jQuery benutzt CSS-Selektoren, um Elemente auszuwählen.;false;;;;;;;;;;;;1;0;;;;;;;;;;Richtig;Falsch;;;;;;;;;;;;
1218;VS;SC;Ist jQuery eine Library für client scripting oder server scripting?;false;client scripting;server scripting;;;;;;;;;;1;0;;;;;;;;;;;;;;;;;;;;;;;
1219;VS;DD;Was machen folgende PHP-Funktionen?;false;Führt eine SQL-Abfrage auf einer MySQL-Datenbank durch.;Schließt eine Verbindung zu einer MySQL-Datenbank.;Stellt unter Angabe der Verbindungsdaten eine Verbindung mit einer MySQL-Datenbank her.;;;;;;;;;2;3;1;;;;;;;;;mysqli_connect();mysqli_query();mysqli_close();;;;;;;;;;;
1220;VS;SC;Der Servlet-Kontext-Listener wird nur benachrichtigt, wenn der Kontext initialisiert wird.;false;;;;;;;;;;;;0;1;;;;;;;;;;Richtig;Falsch;;;;;;;;;;;;
1221;VS;SC;Der Servlet-Kontext-Listener wird benachrichtigt, wenn der Kontext initialisiert oder zerstört wird.;false;;;;;;;;;;;;1;0;;;;;;;;;;Richtig;Falsch ;;;;;;;;;;;;
1222;Statistik;MC;Wie definiert man ein Ereignis?;false;Eine Menge von Elementarereignissen.;Das Ergebnis einer Zuordnung.;Eine Teilmenge des Ergebnisraums.;Die Schnittmenge aller Zufallsexperimente. ;;;;;;;;1;0;1;0;;;;;;;;;;;;;;;;;;;;;
1223;Statistik;MC;Das Signifikanzniveau …;false;… heißt α und ist eine kleine Zahl nahe Null.;… wird bei Hypothesentests als Fehler der ersten Art gewertet. ;… berechnet man mit dem Median.;… kann nur durch eine Stichprobe mit mehr als 100 Beobachtungsobjekten festgelegt werden.;… gibt im Hypothesentest an, welches Risiko man bereit ist einzugehen, eine falsche Entscheidung zu treffen;;;;;;;1;0;0;0;1;;;;;;;;;;;;;;;;;;;;
1224;Statistik;SC;Entlang der Äste eines Wahrscheinlichkeitsbaums wird…;false;… addiert.;… subtrahiert. ;… multipliziert.;… dividiert.;;;;;;;;0;0;1;0;;;;;;;;;;;;;;;;;;;;;
1225;Statistik;SC;Für das Würfeln mit zwei Würfeln ist die Wahrscheinlichkeiten des Ereignisses, dass die Augenzahl größer als 10 ist…;false;… 1/10.;… 6/10.;… 1/12.;0;;;;;;;;0;0;1;0;;;;;;;;;;;;;;;;;;;;;
1226;Statistik;SC;Welche Arten von Hypothesentests gibt es?;false;Relativer und prozentualer Hypothesentest.;Einseitger und zweiseitiger Hypothesentest. ;Statistiscer und dynamischer Hypothesentest.;Normalverteilter und standardnormalverteilter Hypothesentest.;;;;;;;;0;1;0;0;;;;;;;;;;;;;;;;;;;;;
1227;Statistik;SC;Die IMBIT Krake möchte nachweisen, dass ihre 20 IT-Services im Durchschnitt von mehr als 10 Mitarbeitern betreut werden. Welche Hypothesen sollte sie testen?;false;"H0:μ≤20;H1:μ>20";"H0:μ≤10;H1:μ>10";"H0:μ>20;H1:μ≤20";"H0:μ>20;H1:μ>10";;;;;;;;0;1;0;0;;;;;;;;;;;;;;;;;;;;;
1228;Statistik;SC;Die IMBIT Krake möchte die Kunden ihres IT-Unternehmens besser kennenlernen und stellt fest, dass die unterschiedlichen Unternehmen 140, 211, 127, 290, 195, 150 und 143 Mitarbeiter haben. Wie groß ist die Spannweite dieser Unternehmensgrößen?;false;150;1256;19,4;3;;;;;;;;1;0;0;0;;;;;;;;;;;;;;;;;;;;;
1229;Statistik;SC;In welchem Fall wird der Satz von Bayer angewandt?;false;Durch neu gewonnene Informationen können schon ermittelte Wahrscheinlichkeiten genauer bestimmt werden.;Durch verringerten Ergebnisraum können schon ermittelte Wahrscheinlichkeiten genauer bestimmt werden.;;;;;;;;;;1;0;;;;;;;;;;;;;;;;;;;;;;;
1230;Statistik;DD;Das IT-Unternehmen der IMBIT Krake bekommt Rechnungen mit den folgenden Werten: 50€, 100€, 81€, 250€, 1000€, 44€, 250€. Ordne die Lagemaße korrekt zu.;false;250;100;254;;;;;;;;;3;1;2;;;;;;;;;Median;Mittelwert;Modus;;;;;;;;;;;
1231;Statistik;DD;Die IMBIT Krake möchte die offenen Stellen in ihrem IT-Unternehmen besetzen. Sie sucht folgende Mitarbeiter: HR : 2, Service Desk : 5, Marketing : 3, Sales : 5, Buchhaltung : 3, SAP Consultant : 5, Einkauf : 1, Network Engineer : 3, Presales : 3, Motivationstrainer : 0, Controlling : 3, Entwickler : 5, Jurist : 1, Praktikant : 1. Ordne die absolute Häufigkeit korrekt den offenen Stellen zu.;false;0;1;2;3;4;5;;;;;;2;1;5;6;4;3;;;;;;3;1;4;0;2;5;;;;;;;;
1232;Statistik;DD;Ordne den Verteilungen ihre Schiefe zu.;false;Symmetrisch.;Linksschief bzw. rechtssteil.;Rechtsschief bzw. linkssteil.;;;;;;;;;2;3;1;;;;;;;;;> 0;0;< 0;;;;;;;;;;;
1233;Statistik;DD;Die IMBIT Krake möchte ihr Produktportfolio erweitern und macht dafür eine Kundenumfrage. 10 der 70 Dienstleistungsunternehmen interessieren sich für IoT, 60 für eine Cloud. 50 der 130 Produktionsunternehmen interessieren sich für IoT, 80 für eine Cloud. Ordne die Wahrscheinlichkeiten korrekt zu.;false;10/200 = 0.05;(60/200)+(130/200)-(50/200) = 0.7;60/200 = 0.3;;;;;;;;;1;3;2;;;;;;;;;Ein Unternehmen ist an IoT Services interessiert.;Ein Produktionsunternehmen ist an IoT Services interessiert.;Ein Unternehmen ist an IoT interessiert oder ist ein Produktionsunternehmen.;;;;;;;;;;;
1234;Statistik;TQ;Der Gini-Koeffizient.;false;;;;;;;;;;;;;;;;;;;;;;;;;;;;;;;;;;;;
1235;Statistik;OD;In welcher Reihenfolge kann man die folgenden Werte berechnen?;false;Standardabweichung;Varianz;Durchschnitt;;;;;;;;;3;1;2;;;;;;;;;;;;;;;;;;;;;;
1236;Statistik;TL;Ordne die englischen Begriffe den deutschen Begriffen zu. ;false;Binomialverteilung;Zufallsvariable;Intervallschätzung;Hypothesentest;Stichprobe;Interquartilsabstand;arithmetisches Mittel;Häufigkeitsverteilung;Säulendiagramm;Signifikanzniveau;;8;3;5;4;1;6;9;10;2;7;;Sample ;Bar Graph;Random Variable;Hypothesis Testing;Interval Estimation;Interquartile Range;Significance Level;Binominal Distribution;Arithmetic Mean;Frequency Distribution;;;;
1237;Controlling;SC;Was zählt nicht zu den wesentlichen Aufgaben des Controllings?;false;Das Sicherstellen von Transparenzen im Hinblick auf Strategien, Ergebnisse, Finanzen und Prozesse.;Die unternehmensübergreifende Gestaltung des zukunftsorientierten Berichtswesens .;Das Pflegen der Controllingsysteme.;Die Unterstützung des Managementsprozesses der Zielfindung, Planung und Steuerung.;Kontrolle von eingehenden Rechnungen;;;;;;;0;0;0;0;1;;;;;;;;;;;;;;;;;;;;
1238;Controlling;MC;Welche Komponenten gehören zum Führungssystem eines Unternehmens?;false;Zielsystem ;Organisationssystem;Betriebssystem;Projektmanagementsystem;Personalführungssystem;Informationssystem;Planungs- und Kontrollsystem;;;;;1;1;0;0;1;1;1;;;;;;;;;;;;;;;;;;
1239;Controlling;DD;Ordne die folgenden Planungshorizonte richtig zu. ;false;Bis zu einem Jahr;Zwischen einem und fünf Jahren;Mehr als fünf Jahre;;;;;;;;;3;1;2;;;;;;;;;Taktisch ;Strategisch;Operativ;;;;;;;;;;;
1240;Controlling;DD;Ordne die folgenden Controllinginstrumente richtig zu. ;false;Soll-Ist-Analyse;Szenarioanalyse;ABC-Analyse;Nutzwertanalyse;Budgetierung;Umweltanalyse;Berichtswesen;Stärken-Schwächen-Analyse;;;;2;1;2;1;2;1;2;1;;;;Strategisch;Operativ;;;;;;;;;;;;
1241;Controlling;DD;Ordne folgende strategische Controllinginstrumente richtig zu. ;false;Marktwachstums-Marktanteils-Portfolio von BCG;Wertkettenanalyse;St. Galler Managementmodell;PESTL-Analyse;Produkt-Markt-Expansionsraster nach Ansoff;Five Forces nach Porter;;;;;;1;1;2;2;1;2;;;;;;Intern;Extern;;;;;;;;;;;;
1242;Controlling;MC;Aus welchen Perspektiven setzt sich die Balanced Scorecard zusammen?;false;Finanzperspektive;Produktperspektive;Kundenperspektive;Potenzialperspektive;Preisperspektive;Prozessperspektive;Lieferantenperspektive;;;;;1;0;1;0;1;0;1;0;;;;;;;;;;;;;;;;;
1243;Controlling;DD;Ordne folgene Ziele der richtigen Perspektive aus dre BSC zu. ;false;Mitarbeiterzufriedenheit steigern;Hoher Marktanteil;Effizienz steigern;;;;;;;;;4;2;3;1;;;;;;;;Finanzperspektive;Kundenperspektive;Prozessperspektive;Potenzialperspektive;;;;;;;;;;
1244;Controlling;MC;Wähle die Kennzahlen, die Finanzkennzahlen darstellen, aus.;false;CPO;EBIT;ROCE;NPS;EVA;ROI;;;;;;0;1;1;0;1;1;;;;;;;;;;;;;;;;;;;
1245;Controlling;DD;Ordne die folgenden Definitionen je einer Kennzahl zu.;false;Operatives Ergebnis (Bruttogewinn);Differenz aus Geschäftsergebnis und Kapitalkosten (Übergewinn);Setzt den Gewinn ins Verhältnis zum eingesetzten Kapital (Rentabilitätsmaß).;;;;;;;;;1;2;3;;;;;;;;;EBIT;EVA;ROI;;;;;;;;;;;
1246;Controlling;SC;Ein Unternehmen mit 40% Eigenkapital hat einen Betafaktor in Höhe von 1,7. Der risikolose Habenzins beträgt 3%, der Sollzins 9%. Die Risikoprämie am Markt liegt bei 5%, der Steuersatz bei 35%. Berechne die WACC.;false;10,03 %%;9,24 %;7,62 % ;8,11 %;;;;;;;;0;0;1;;;;;;;;;;;;;;;;;;;;;;
1247;Controlling;SC;Der ROI eignet sich besonders für produzierende Unternehmen als Steuerungsgröße, da er das operative Ergebnis in Relation zum eingesetzten Kapital darstellt.;false;Wahr;Falsch;;;;;;;;;;1;0;;;;;;;;;;;;;;;;;;;;;;;
1248;Controlling;SC;Aus welchen zwei Kennzahlen setzt sich der ROI multiplikativ zusammen?;false;Verschuldungsgrad und Investitionsquote;Umsatzrendite und Kapitalumschlag;Abschreibungsquote und Nettoinvestitionsquote;Eigenkapitalquote und Dividendenrendite;;;;;;;;0;1;0;0;;;;;;;;;;;;;;;;;;;;;
1249;Controlling;MC;Ein Unternehmen erwirtschaftet jährlich einen Gewinn von 15 Mio €. Dabei beträgt der Umsatz 300 Mio €, die Bilanzsumme 420 Mio €. Welche der folgenden Aussagen sind korrekt?;false;Der Kapitalumschlag beträgt 14 %.;Die Umsatzrendite beträgt 5 %.;Der ROI beträgt 3,58 %.;Der Kapitalumschlag liegt bei 71%.;Die Umsatzrendite liegt bei 200%.;Der ROI liegt bei 28%.;;;;;;0;1;1;1;0;0;;;;;;;;;;;;;;;;;;;
1250;Controlling;SC;Ein Unternehmen erwirtschaftet ein NOPAT in Höhe von 50 Mio €. Dabei beträgt die Bilanzsumme 250 Mio €, die WACC betragen 8%. Berechne den EVA.;false;15 Mio €;20 Mio €;25 Mio €;30 Mio €;;;;;;;;0;0;0;1;;;;;;;;;;;;;;;;;;;;;
1251;Controlling;TL;Ordne den Begriffen jeweils ihre passende Übersetzung zu.;false;Sales;Revenue;Earnings;Reporting;Cash Flow;Budgeting;Planning;Weighted Average Capital Cost;Strategic;Operating;;4;6;1;8;5;2;9;10;3;7;;Ergebnis;Budgetierung;Strategisch ;Absatz;Kapitalfluss;Umsatz;Operativ;Berichtswesen;Planung;Gewichtete durchschnittliche Kapitalkosten;;;;
1252;porter;MC;Aus welchen elementaren Bausteinen besteht die Value Chain?;false;Gewinnspanne;Primäraktivitäten;Geschäftsprozesse;sekundäre Aktivitäten;Strategie-Beratung;;;;;;;1;1;0;1;0;;;;;;;;;;;;;;;;;;;;
1253;porter;DD;Ordne folgende Begriffe zu:;false;Einkauf und Beschaffung;Produktion;Personalwirtschaft;Marketing und Vertrieb;Kundenservice;;;;;;;2;3;4;5;1;;;;;;;Customer Relationship Management;Procurement;Production Planning;HR;Sales Distribution;;;;;;;;;
1254;porter;DD;Sind folgende Aktivitäten primär oder sekundär?;false;Eingangslogistik;Beschaffung;Ausgangslogistik;Technologieentwicklung;Marketing;Personalwirtschaft;Produktion;Unternehmensinfrastruktur;Kundendienst;;;1;2;1;2;1;2;1;2;1;;;Primäre Aktivitäten;Sekundäre Aktivitäten;;;;;;;;;;;;
1255;porter;SC;Welche der folgenden Aussagen ist wahr?;false;Es gibt keinen Unterschied zwischen sekundären und primären Aktivitäten.;Primäraktivitäten sind die Tätigkeiten, die einen direkten wertschöpfenden Beitrag zur Erstellung eines Produktes oder einer Dienstleistung liefern. Sekundäre Aktivitäten sind Tätigkeiten, die für die Ausübung der primären Aktivitäten die notwendige Voraussetzung sind. Sie liefern somit einen indirekten Beitrag zur Erstellung eines Produktes oder einer Dienstleistung.;Sekundäre Aktivitäten  sind die Tätigkeiten, die einen direkten wertschöpfenden Beitrag zur Erstellung eines Produktes oder einer Dienstleistung liefern. Primäre Aktivitäten sind Tätigkeiten, die für die Ausübung der sekundären Aktivitäten die notwendige Voraussetzung sind. Sie liefern somit einen indirekten Beitrag zur Erstellung eines Produktes oder einer Dienstleistung.;;;;;;;;;0;1;0;;;;;;;;;;;;;;;;;;;;;;
1256;porter;MC;Welche der folgenden Aussagen sind wahr?;false;Die Value Chain von Michale Porter stellt die Stufen der Produktion als eine geordnete Reihung von Tätigkeiten dar.;Die Wertschöpfungskette besteht aus primären Aktivitäten wie beispielsweise der Personalwirtschaft und sekundären Aktivitäten wie beispielsweise Marketing und Vertrieb.;Die Portersche Value Chain setzt sich aus den einzelnen Wertaktivitäten und der Gewinnspanne zusammen. Wertaktivitäten sind Tätigkeiten, die zur Herstellung eines Produktes oder einer Dienstleistung erbracht werden. Die Gewinnspanne ist der Unterschied zwischen dem Ertrag, den dieses Produkt erbringt, und den eingesetzten Ressourcen.;;;;;;;;;1;0;1;;;;;;;;;;;;;;;;;;;;;;
1257;porter;MC;Aus welchen fünf Kräften besteht das Five Forces Model von Michael Porter?;false;Zulieferer;Marketing;Vertrieb;Kunden;After-Sales Service;Ersatzprodukte;Export und Import;Potenzielle Mitbewerber;Mitbewerber Rivalität;;;1;0;0;1;0;1;0;1;1;;;;;;;;;;;;;;;;
1258;porter;DD;Ordne folgende Begriffe zu:;false;Bedrohung durch Substitutionsprodukte;Bedrohung durch neue Anbieter;Verhandlungsstärke der Lieferanten;Verhandlungsstärke der Abnehmer;Rivalität unter den bestehenden Wettbewerbern;;;;;;;2;5;1;3;4;;;;;;;Zulieferer;Ersatzprodukte;Kunden;Mitbewerber Rivalität;Potenzielle Mitbewerber;;;;;;;;;
1259;porter;DD;Ordne folgende Begriffe zu:;false;Ein Frucht- und Kräuterlieferant eines Bionadeherstellers könnte damit drohen, die Rohstoffe selbst zu einer Limonade zu verarbeiten.;Siruphersteller: Mittels Sirup lässt sich Leitungswasser zu einem geschmackhaltigen Erfrischungsgetränk aufwerten, welches ein Substitut für Softdrinks darstellt.;Ein Großabnehmer könnte die Softdrink Preise in gewisser Weise drücken, und damit drohen anstelle von Softdrink-Automaten, frischgepresste Säfte auszuschenken.;Coca Cola hat einen sehr großen Bekanntheitsgrad und befindet sich im Kühlschrank vieler Kunden. Um als Mitbewerber in den Markt einzutreten sind erhöhte Werbekosten nötig, um das eigene Produkt dem Kunden schmackhaft zu machen.;Die Rivalität in dem deutschen Getränkemarkt ist groß. Die Gesellschaft altert und ein großes Marktwachstum ist nicht erkennbar. Es sind einige „Bigplayer“ wie bspw. CocaCola  am Markt vertreten welche über eine hohe Kundenloyalität und hohe Werbebudgets verfügen.;;;;;;;1;2;3;4;5;;;;;;;Zulieferer;Ersatzprodukte;Kunden;Potenzielle Mitbewerber;Mitbewerber Rivalität;;;;;;;;;
1260;porter;MC;Welche der folgenden Aussagen sind wahr?;false;Das Five Forces Modell basiert darauf, dass die Attraktivität einer Branche durch die Ausprägung der fünf wesentlichen Wettbewerbskräfte bestimmt wird.;Je geringer die Bedrohung der Five Forces ist, desto unattraktiver ist die betrachtete Branche und desto schwieriger ist es, einen nachhaltigen Wettbewerbsvorteil zu erzielen.;Die Five Forces werden nie für die gesamte Branche betrachtet.;Unternehmen sollten eher versuchen, in einer Branche mit attraktiver Branchenstruktur tätig zu sein und eine verteidigungsfähige Position in ihrer Branche aufzubauen, also eine Position in der die fünf Wettbewerbskräfte eine möglichst wenig bedrohliche Ausprägung aufweisen.;;;;;;;;1;0;0;1;;;;;;;;;;;;;;;;;;;;;
1261;porter;DD;Ordne folgende Begriffe zu:;false;Einzigartigkeit;Gesamtmarkt;Teilmarkt;Kostenvorsprung;;;;;;;;2;1;1;2;;;;;;;;Wettbewerbsbreite;strategischer Vorteil;;;;;;;;;;;;
1262;porter;TQ;;false;;;;;;;;;;;;;;;;;;;;;;;;;;;;;;;;;;;;
1263;porter;DD;Ordne folgende Begriffe zu:;false;Konstant hohe Geschwindigkeit;Permanente Innovationen;Größenvorteile;Kostenvorteile durch Beschränkung auf ein Segment;Standortvorteile;Automatisierung;Zeitvorteile;Flexibilität;;;;1;1;3;2;1;3;3;2;;;;Differenzierungsvorteile;Nischenvorteile;Kostenvorteile;;;;;;;;;;;
