subject;questionType;id;completed;question;answers/0;answers/1;answers/2;answers/3;answers/4;answers/5;answers/6;answers/7;answers/8;answers/9;answers/10;answers/11;answers/12;answers/13;answers/14;answers/15;answers/16;answers/17;answers/18;answers/19;correct/0;correct/1;correct/2;correct/3;correct/4;correct/5;correct/6;correct/7;correct/8;correct/9;correct/10;correct/11;correct/12;correct/13;correct/14;correct/15;correct/16;correct/17;correct/18;correct/19;title/0;title/1;title/2;title/3;title/4;title/5;title/6;title/7;title/8;title/9;;;;;;;;;;;;;;;;;;;;;;;;;;
Datenbanken;SC;1148;false;Wie werden Daten in den Hauptspeicher übertragen?;Blockweise;Seitenweise;Je ein Datensatz;;;;;;;;;;;;;;;;;;1;0;0;;;;;;;;;;;;;;;;;;;;;;;;;;;;;;;;;;;;;;;;;;;;;;;;;;;;;
Datenbanken;MC;1149;false;Welche Anomalien können auftreten?;Löschanomalien;Updateanomalien;Einfügeanomalien;Cascadeanomalien;;;;;;;;;;;;;;;;;1;1;0;;;;;;;;;;;;;;;;;;;;;;;;;;;;;;;;;;;;;;;;;;;;;;;;;;;;;
Datenbanken;SC;1150;false;Was versteht man unter einem Primärschlüssel?;Primärschlüssel einer Relation, der in einer anderen Relation platziert wird, um so eine Beziehung zwischen den Relationen herzustellen.;Genau ein Kandidatenschlüssel wird als diese Art von Schlüssel festgelegt.;Ein Schlüssel, der künstlich zur Relation hinzugefügt wird, um als Primärschlüssel zu fungieren.;Eine Menge von non-null Attributen, von der die gesamt Attributmenge funktional abhängig ist.;;;;;;;;;;;;;;;;;0;1;0;0;;;;;;;;;;;;;;;;;;;;;;;;;;;;;;;;;;;;;;;;;;;;;;;;;;;;
Datenbanken;SC;1151;false;Bei welcher Art der Datensatzspeicherung werden Datensätze als Key-Value-Paare gespeichert?;Fixlängen-Speicherung;Speicherung in variabler Länge;;;;;;;;;;;;;;;;;;;0;1;;;;;;;;;;;;;;;;;;;;;;;;;;;;;;;;;;;;;;;;;;;;;;;;;;;;;;
Datenbanken;SC;1152;false;Wann muss die Organisationsform »Spanned« verwendet werden?;bfr=100;bfr=10;bfr=1;bfr=0;;;;;;;;;;;;;;;;;0;0;0;1;;;;;;;;;;;;;;;;;;;;;;;;;;;;;;;;;;;;;;;;;;;;;;;;;;;;
Datenbanken;MC;1153;false;Aus welchen Operationen setzt sich die Löschoperation bei B-Bäumen zusammen?;Rotation;Turn ;Merge;Spin;Delete;Insert;;;;;;;;;;;;;;;1;0;1;0;0;0;;;;;;;;;;;;;;;;;;;;;;;;;;;;;;;;;;;;;;;;;;;;;;;;;;
Datenbanken;SC;1154;false;Die Ordnung eines B-Baumes in einem Computersystem kann nicht beliebig erhöht werden, da ein Knoten einem Block/einer Seite entspricht und Blöcke in einem Computersystem durch eine feste Größe begrenzt sind.;Wahr ;Falsch ;;;;;;;;;;;;;;;;;;;1;0;;;;;;;;;;;;;;;;;;;;;;;;;;;;;;;;;;;;;;;;;;;;;;;;;;;;;;
Datenbanken;SC;1155;false;Wofür steht HANA?;High Performance Analytic Application;High Performance Analytic Appliance;;;;;;;;;;;;;;;;;;;1;0;;;;;;;;;;;;;;;;;;;;;;;;;;;;;;;;;;;;;;;;;;;;;;;;;;;;;;
Datenbanken;SC;1156;false;Was unterscheidet HANA von anderen relationalen Datenbanken (Oracle, MS-SQL, etc.)?;HANA arbeitet spaltenorientiert, andere relationale Datenbanken arbeiten zeilenorientiert;HANA arbeitet zeilenorientiert, andere relationale Datenbanken arbeiten spaltenorientiert;;;;;;;;;;;;;;;;;;;1;0;;;;;;;;;;;;;;;;;;;;;;;;;;;;;;;;;;;;;;;;;;;;;;;;;;;;;;
Datenbanken;SC;1157;false;HANA ist eine In-Memory-Datenbank.;Wahr ;Falsch ;;;;;;;;;;;;;;;;;;;1;0;;;;;;;;;;;;;;;;;;;;;;;;;;;;;;;;;;;;;;;;;;;;;;;;;;;;;;
Datenbanken;TL;1158;false;Ordne den englischen Begriff dem Deutschen zu.;Row;Column;Attribute;Entity;Relationship;Relational Database;Table;Atomicity;Normal Form;Foreign Key;Consistency;Query;Isolation;Composite Key;Primary Key;Durability;Database;Candidate Key;Surrogate Key;Referential Integrity;3;6;7;15;10;9;14;4;20;18;5;1;12;2;16;19;13;8;17;11;Abfrage;Zusammengesetter Schlüssel;Zeile;Atomarität;Konsistenz;Spalte;Attribut;Kandidatenschlüssel;Relationale Datenbank;Beziehung;;;;;;;;;;;;;;;;;;;;;;;;;;
Finanzierung;DD;1159;false;Investition oder Finanzierung?;Kauf einer Maschine;Aufnahme einer zweiten Hypothek;Emission von jungen Aktien;Kauf von Unternehmensanleihen;Durchführen einer Kapitalerhöhung;Einbehaltung von Unternehmensgewinn;Erweiterung des Fuhrparks;Mitarbeiter werden geschult;;;;;;;;;;;;;1;2;2;1;2;2;1;1;;;;;;;;;;;;;Investition;Finanzierung;;;;;;;;;;;;;;;;;;;;;;;;;;;;;;;;;;
Finanzierung;DD;1160;false;Eigenfinanzierung oder Fremdfinanzierung?;Abschreibung;Abschreibung;Abschreibung;Abschreibung;Abschreibung;Abschreibung;Abschreibung;Abschreibung;Abschreibung;Abschreibung;;;;;;;;;;;1;2;2;2;1;1;2;1;2;2;;;;;;;;;;;Eigenfinanzierung;Fremdfinanzierung;;;;;;;;;;;;;;;;;;;;;;;;;;;;;;;;;;
Finanzierung;DD;1161;false;Innenfinanzierung oder Außenfinanzierung?;Abschreibung;Abschreibung;Abschreibung;Abschreibung;Abschreibung;Abschreibung;Abschreibung;Abschreibung;Abschreibung;Abschreibung;;;;;;;;;;;1;2;1;2;1;1;2;1;2;2;;;;;;;;;;;Innenfinanzierung;Außenfinanzierung;;;;;;;;;;;;;;;;;;;;;;;;;;;;;;;;;;
Finanzierung;MC;1162;false;Welche der folgenden Aussagen sind korrekt?;Unternehmensanleihen gehören sowohl zur Eigenfinanzierung als auch zur Außenfinanzierung.;Rückstellungen gehören sowohl zur Fremdfinanzierung als auch zur Innenfinanzierung.;Einbehaltene Gewinne gehören sowohl zur Eigenfinanzierung als auch zur Innenfinanzierung.;Desinvestitionen gehören sowohl zur Fremdfinanzierung als auch zur Außenfinanzierung.;;;;;;;;;;;;;;;;;0;1;1;0;;;;;;;;;;;;;;;;;;;;;;;;;;;;;;;;;;;;;;;;;;;;;;;;;;;;
Finanzierung;SC;1163;false;Welche der folgenden Aussagen sind korrekt?;Eine Erhöhung des Verschuldungsgrades führt zu einer höheren Eigenkapitalrendite, wenn die Gesamtkapitalrendite kleiner als der Fremdkapitalzins ist.;Eine Senkung des Verschuldungsgrades führt zu einer höheren Eigenkapitalrendite, wenn die Gesamtkapitalrendite kleiner als der Fremdkapitalzins ist.;Eine Erhöhung des Verschuldungsgrades führt zu einer höheren Eigenkapitalrendite, wenn die Gesamtkapitalrendite größer als der Fremdkapitalzins ist.;Eine Senkung des Verschuldungsgrades führt zu einer höheren Eigenkapitalrendite, wenn die Gesamtkapitalrendite größer als der Fremdkapitalzins ist.;;;;;;;;;;;;;;;;;0;0;1;0;;;;;;;;;;;;;;;;;;;;;;;;;;;;;;;;;;;;;;;;;;;;;;;;;;;;
Finanzierung;TQ;1164;false;Investition und Finanzierung;Eine Investition beginnt in der Regel mit einer;;während eine Finanzierung mit einer;;beginnt. Außerdem befasst sich die Investition mit der;;die Finanzierung hingegen mit der;;.;;;;;;;;;;;;;4;2;1;3;;;;;;;;;;;;;;;;Mittelherkunft;Einzahlung;Auszahlung;Mittelverwendung;;;;;;;;;;;;;;;;;;;;;;;;;;;;;;;;
Finanzierung;TQ;1165;false;Industrieanleihe;Bei einer Industrieanleihe, auch;;genannt, erhält der Inhaber regelmäßig;;. Am Ende der Laufzeit erfolgt zusätzlich;;. Dabei beeinflusst;;des Emittenten sowohl den Zins als auch den Kurs der Industrieanleihe.;;;;;;;;;;;;;4;1;3;2;;;;;;;;;;;;;;;;die Bonität;Corporate Bond;die Tilgung;Zinsenzahlungen;;;;;;;;;;;;;;;;;;;;;;;;;;;;;;;;
Finanzierung;TQ;1166;false;Null-Kupon-Anleihen;Bei einer Null-Kupon-Anleihe, auch;;genannt, erhält der Inhaber keine Zinszahlungen;;sondern nur;;. Der Kurs einer Null-Kupon-Anleihe unterliegt dem;;.;;;;;;;;;;;;;3;1;2;4;;;;;;;;;;;;;;;;am Ende der Laufzeit;Zero Bond;während der Laufzeit;Zinsänderungsrisiko;;;;;;;;;;;;;;;;;;;;;;;;;;;;;;;;
Finanzierung;TQ;1167;false;Genusschein;Genussscheine gehören weder zum Eigen- noch zum Fremdkapital, sondern zum;;. Der Inhaber hat beispielsweise einen Anspruch auf Beteiligung am;;oder am Liquidationserlös. Gewöhnlich werden Genussscheine wie Fremdkapital behandelt, wodurch sich;;für den Emittenten ergeben.;;;;;;;;;;;;;;;1;3;2;;;;;;;;;;;;;;;;;Hybridkapital;Steuervorteile;Reingewinn;;;;;;;;;;;;;;;;;;;;;;;;;;;;;;;;;
Finanzierung;TQ;1168;false;Wandelschuldverschreibung;Eine Wandelschuldverschreibung, auch;;genannt, funktioniert im Wesentlichen wie eine;;. Der Inhaber hat jedoch zusätzlich ein;;, das heißt er darf die Schuldverschreibung in;;umtauschen.;;;;;;;;;;;;;3;1;4;2;;;;;;;;;;;;;;;;Wandlungsrecht;Convertible Bond;Aktien;Industrieanleihe;;;;;;;;;;;;;;;;;;;;;;;;;;;;;;;;
Finanzierung;TQ;1169;false;Optionsschuldverschreibung;Ein Optionsschein beinhaltet das Recht, einen bestimmten;;zu einem festgelegten;;entweder zu kaufen;;oder zu verkaufen;;.;;;;;;;;;;;;;3;2;4;1;;;;;;;;;;;;;;;;Call;Basispreis;Put;Basiswert;;;;;;;;;;;;;;;;;;;;;;;;;;;;;;;;
Finanzierung;TQ;1170;false;Leasing;Unter Leasing versteht man die entgeltliche;;eines Leasingobjekts. Ein Vorteil des Leasings besteht in der geringen;;: Während die;;(capex) sinken, steigen die;;(opex).;;;;;;;;;;;;;3;1;4;2;;;;;;;;;;;;;;;;Investitionsausgaben;Nutzungsüberlassung;Betriebsausgaben;Kapitalbindung;;;;;;;;;;;;;;;;;;;;;;;;;;;;;;;;
Finanzierung;TQ;1171;false;Factoring;Unter Factoring versteht man einen;;. Dabei verkauft der;;seine Forderung an den;;und sendet dem;;eine Rechnung, der diese gegenüber dem Factor begleicht.;;;;;;;;;;;;;3;2;4;1;;;;;;;;;;;;;;;;Factor;Factoringkunde;Abnehmer;Forderungsankauf;;;;;;;;;;;;;;;;;;;;;;;;;;;;;;;;
Finanzierung;TQ;1172;false;Crowd Funding;Unter Crowd Funding versteht man eine Form der;;durch mehrere Internetnutzer, daher auch;;genannt. Hierzu wird beispielsweise über eine spezielle;;zu einer;;aufgerufen;;;;;;;;;;;;;2;3;1;4;;;;;;;;;;;;;;;;Schwarmfinanzierung;Plattform;Finanzierung;Beteiligung;;;;;;;;;;;;;;;;;;;;;;;;;;;;;;;;
Finanzierung;TL;1173;false;Ordne den englischen Begriff dem Deutschen zu.;stock;external financing;bond;equity financing;interest rate;financial planning;internal financing;warrant;yiel to maturity;debt financing;;;;;;;;;;;3;6;1;7;4;10;5;9;2;8;;;;;;;;;;;Anleihe;Rendite bis Fälligkeit;Aktie ;Zinssatz;Innenfinanzierung;Außenfinanzierung;Eigenfinanzierung;Fremdfinanzierung;Optionsschein;Finanzplanung;;;;;;;;;;;;;;;;;;;;;;;;;;
Geschäftsprozessmanagement;MC;1174;false;Wähle die Anforderungen an Unternehmen, die heutzutage entscheidend sind.;Schnelligkeit;Gute Dokumentation;Hohe Preise;Nutzung der Plankostenrechnung;Flexibilität;Produktorientierung;;;;;;;;;;;;;;;1;0;0;0;1;0;;;;;;;;;;;;;;;;;;;;;;;;;;;;;;;;;;;;;;;;;;;;;;;;;;
Geschäftsprozessmanagement;SC;1175;false;Der Schwerpunkt von Geschäftsprozessmanagement liegt in der technischen Umsetzung. Die Analyse und Optimierung dieser sind nicht von großer Bedeutung.;Wahr;Falsch;;;;;;;;;;;;;;;;;;;0;1;;;;;;;;;;;;;;;;;;;;;;;;;;;;;;;;;;;;;;;;;;;;;;;;;;;;;;
Geschäftsprozessmanagement;DD;1176;false;Ordne die Ebenen der Prozessbetrachtung den verschiedenen Fokuspunkten zu. ;Modellierung;Analyse;Darstellung;Technische Umsetzung;Optimierung;;;;;;;;;;;;;;;;2;2;1;3;2;;;;;;;;;;;;;;;;Fokus: Dokumentation ;Fokus: Gestaltung;Fokus: Implementierung;;;;;;;;;;;;;;;;;;;;;;;;;;;;;;;;;
Geschäftsprozessmanagement;MC;1177;false;Wie ist ein Prozess definiert?;Ein Rahmenkonzept zur Gestaltung der betrieblichen Abläufe.;Ein Vergleich von Mitarbeitern.;Eine Abfolge von Transaktionen;Eine Abfolge von Aktivitäten und Zuständen;;;;;;;;;;;;;;;;;0;0;0;1;;;;;;;;;;;;;;;;;;;;;;;;;;;;;;;;;;;;;;;;;;;;;;;;;;;;
Geschäftsprozessmanagement;SC;1178;false;Im Geschäftsprozessmanagement gilt der Grundsatz: »Strategie vor Methodik vor Werkzeug«.;Wahr;Falsch;;;;;;;;;;;;;;;;;;;1;0;;;;;;;;;;;;;;;;;;;;;;;;;;;;;;;;;;;;;;;;;;;;;;;;;;;;;;
Geschäftsprozessmanagement;SC;1179;false;Geschäftsprozessmanagement beinhaltet Ansätze wie Business Process Reengineering oder Continuous Improvement.;Wahr;Falsch;;;;;;;;;;;;;;;;;;;1;0;;;;;;;;;;;;;;;;;;;;;;;;;;;;;;;;;;;;;;;;;;;;;;;;;;;;;;
Geschäftsprozessmanagement;SC;1180;false;Ist eine Prozesskostenanalyse eine Methode oder eine Kenngröße?;Methode;Kenngröße;;;;;;;;;;;;;;;;;;;1;0;;;;;;;;;;;;;;;;;;;;;;;;;;;;;;;;;;;;;;;;;;;;;;;;;;;;;;
Geschäftsprozessmanagement;SC;1181;false;Ein Workflow kann als Abfolge von Transaktionen zwischen Objekten angesehen werden.;Wahr;Falsch;;;;;;;;;;;;;;;;;;;1;0;;;;;;;;;;;;;;;;;;;;;;;;;;;;;;;;;;;;;;;;;;;;;;;;;;;;;;
Geschäftsprozessmanagement;DD;1182;false;Handelt es sich um eine Methode oder eine Kenngröße? ;Ergebnisqualität;Prozessqualität;Prozessbenchmarking;Prozesskosten;Prozesskostenanalyse;Prozesszeitanalyse;Transportzeiten;;;;;;;;;;;;;;2;2;1;2;1;1;2;;;;;;;;;;;;;;Methoden;Kenngrößen;;;;;;;;;;;;;;;;;;;;;;;;;;;;;;;;;;
Geschäftsprozessmanagement;TQ;1183;false;Geschäftsprozesse und Dokumente. Ziehe das richtige Wort in die Lücke.;Ein;;ist eine Einheit von Informationen, die in einem DV-System als Datei oder als Bestandteil einer Datei vorliegt. Ein; ;ist eine zielgerichtete, zeitlich-logische Abfolge von Aufgaben, die arbeitsteilig von mehreren Organisationen oder Organisationseinheiten unter Nutzung von  Informations- und Kommunikationstechnologien ausgeführt werden können.;;;;;;;;;;;;;;;; ;2; ;1;;;;;;;;;;;;;;;;;Geschäftsprozess;Dokument;;;;;;;;;;;;;;;;;;;;;;;;;;;;;;;;;;
Geschäftsprozessmanagement;SC;1184;false;Wie ist Compliance definiert? ;Eine Einheit von Informationen;Der Vergleich von Geschäftsprozessen;Die Einhaltung von Richtlinien und Gesetzen in einem Unternehmen;Die Systematische Aufzeichnung von Geschäftsvorfällen;;;;;;;;;;;;;;;;;0;0;1;0;;;;;;;;;;;;;;;;;;;;;;;;;;;;;;;;;;;;;;;;;;;;;;;;;;;;
Geschäftsprozessmanagement;SC;1185;false;Welches ist das Standardverfahren für (grundlegende) Rechere in DMS?;Direct Retrieval;Indirect Retrieval;;;;;;;;;;;;;;;;;;;1;0;;;;;;;;;;;;;;;;;;;;;;;;;;;;;;;;;;;;;;;;;;;;;;;;;;;;;;
Geschäftsprozessmanagement;MC;1186;false;Wähle die Zielstellungen des Workflow-Managements aus.;Versionierung;Kontrolle;Qualitätssicherung;Höhere Produktivität;;;;;;;;;;;;;;;;;0;0;1;1;;;;;;;;;;;;;;;;;;;;;;;;;;;;;;;;;;;;;;;;;;;;;;;;;;;;
Geschäftsprozessmanagement;SC;1187;false;Welche Arbeitsabläufe gibt es bei der Erfassung von Papierdokumenten?;Hochladen und herunterladen.;Frühes und spätes Scannen;;;;;;;;;;;;;;;;;;;0;1;;;;;;;;;;;;;;;;;;;;;;;;;;;;;;;;;;;;;;;;;;;;;;;;;;;;;;
Geschäftsprozessmanagement;TL;1188;false;Ordne den Begriffen jeweils ihre passende Übersetzung zu.;Storage Location;Business Process;Research;Key Figures;Process Reengineering;Automatic Processing;Workflow;Transactions;Optimization;Quality Assurance;;;;;;;;;;;4;1;2;3;10;9;8;6;7;5;;;;;;;;;;;Geschäftsprozess;Recherche;Kennzahlen;Ablageort;Qualitätssicherung;Transaktionen;Optimierung;Arbeitsablauf;Automatische Verarbeitung;Prozesserneuerung;;;;;;;;;;;;;;;;;;;;;;;;;;
Investition;MC;1189;false;Was kennzeichnet Investitionen?;Langfristigkeit;Kurzfristigkeit;Mehrere Kapitalgeber;Interdependenz;Keine Kapitalbindung;Hohe Kapitalbindung;;;;;;;;;;;;;;;1;0;0;1;0;1;;;;;;;;;;;;;;;;;;;;;;;;;;;;;;;;;;;;;;;;;;;;;;;;;;
Investition;SC;1190;false;Investitionsrechnungen orientieren sich immer an monetären Zielen.;Wahr;Falsch;;;;;;;;;;;;;;;;;;;1;0;1;;;;;;;;;;;;;;;;;;;;;;;;;;;;;;;;;;;;;;;;;;;;;;;;;;;;;
Investition;SC;1191;false;Wie ist eine Investition definiert?;Eine betriebliche Tätigkeit, die zu unterschiedlichen Zeitpunkten t Aus- und Einzahlungen verursacht, wobei dieser Vorgang immer mit einer Auszahlung beginnt;Mittel- bis langfristige Überlassung von Anlagengegenständen gegen Zahlung eines Nutzungsentgelts;Ein Wertpapier eigener Art;Zahlungsreihe, die in der Regel mit einer Einzahlung beginnt;;;;;;;;;;;;;;;;;1;0;0;0;;;;;;;;;;;;;;;;;;;;;;;;;;;;;;;;;;;;;;;;;;;;;;;;;;;;
Investition;DD;1192;false;Um welche Investitionsart handelt es sich? ;Erwerb von Wertpapieren;Kauf einer neuen Maschine;;Schulungen;Marketing Maßnahmen;;;;;;;;;;;;;;;;1;3;2;2;;;;;;;;;;;;;;;;;Spekulative Finanzinvestition;Immaterielle Sachinvestition;Materielle Sachinvestition;;;;;;;;;;;;;;;;;;;;;;;;;;;;;;;;;
Investition;SC;1193;false;Um welchen Investitionsanlass handelt es sich beim Ersatz von Arbeitskräften durch eine neue Maschine?;Ersatzinvestition-identischer Ersatz;Ersatzinvestition-Rationalisierungsinvestition;Erweiterungsinvestition;Einrichtungsinvestition;;;;;;;;;;;;;;;;;0;1;0;0;;;;;;;;;;;;;;;;;;;;;;;;;;;;;;;;;;;;;;;;;;;;;;;;;;;;
Investition;MC;1194;false;Welche Vorteile hat die Kostenvergleichsrechnung?;Einfache Anwendung;Sagt aus, ob die Investition rentabel ist;Berücksichtigt Qualitätsunterschiede;Anwendbar beiAlternativenvergleich;;;;;;;;;;;;;;;;;1;0;0;1;;;;;;;;;;;;;;;;;;;;;;;;;;;;;;;;;;;;;;;;;;;;;;;;;;;;
Investition;SC;1195;false;Bei der Kostenvergleichsrechnung sind die Kapitalkosten und Betriebskosten zu berücksichtigen.;Wahr;Falsch;;;;;;;;;;;;;;;;;;;1;0;;;;;;;;;;;;;;;;;;;;;;;;;;;;;;;;;;;;;;;;;;;;;;;;;;;;;;
Investition;MC;1196;false;Welche Vorteile hat die Gewinnvergleichsrechnung?;Einfache Anwendung;Einbeziehung des Erlöses einer Investition;Berücksichtigt Qualitätsunterschiede;Unproblematisch bei unterschiedlichen Nutzungsdauern;;;;;;;;;;;;;;;;;1;1;0;0;;;;;;;;;;;;;;;;;;;;;;;;;;;;;;;;;;;;;;;;;;;;;;;;;;;;
Investition;SC;1197;false;Welche Menge muss mindestens abgesetzt werden, damit keine Verluste erzielt werden?;Keine;Break-Even-Menge;Maximale Produktionsmenge;Minimale Produktionsmenge;;;;;;;;;;;;;;;;;0;1;0;0;;;;;;;;;;;;;;;;;;;;;;;;;;;;;;;;;;;;;;;;;;;;;;;;;;;;
Investition;SC;1198;false;Der Gewinn bei der Break-Even-Menge ist größer 0.;Wahr;Falsch;;;;;;;;;;;;;;;;;;;0;1;;;;;;;;;;;;;;;;;;;;;;;;;;;;;;;;;;;;;;;;;;;;;;;;;;;;;;
Investition;SC;1199;false;Bei den dynamischen Investitionsrechnungen werden mehrere Perioden betrachtet.;Wahr;Falsch;;;;;;;;;;;;;;;;;;;1;0;;;;;;;;;;;;;;;;;;;;;;;;;;;;;;;;;;;;;;;;;;;;;;;;;;;;;;
Investition;SC;1200;false;Wie ist der Kapitalwert definiert?;Positive Differenz aus Erträgen und Aufwendungen;Gewinn nach Abzug von Steuern;Kennziffer der dynamischen Investitionsrechnung - Summe der Barwerte einer Investition;Summe der materiellen und immateriellen Güter eines Unternehmens;;;;;;;;;;;;;;;;;0;0;1;0;;;;;;;;;;;;;;;;;;;;;;;;;;;;;;;;;;;;;;;;;;;;;;;;;;;;
Investition;DD;1201;false;Handelt es sich um ein statisches oder dynamisches Investitionsrechenverfahren? ;Kostenvergleichsrechnung;Dynamische Amortisationsdauer;Gewinnvergleichsrechnung;Annuitätenmethode;Kapitalwertmethode;Rentabilitätsrechnung;Amortisationsrechnung;Interner Zinsfuß;;;;;;;;;;;;;1;2;1;2;2;1;1;2;;;;;;;;;;;;;Statische;Dynamische;;;;;;;;;;;;;;;;;;;;;;;;;;;;;;;;;;
Investition;TQ;1202;false;Rentabilitätsrechnung und Amortisationsrechnung.;Die;;macht eine Aussage über;;des eingesetzten;;. Die;;ergänzt die anderen statischen Verfahren um eine;;.;;;;;;;;;;;4;;2;;3;;1;;5;;;;;;;;;;;Amortisationsrechnung;Verzinsung;Kapital;Rentabilitätsrechnung;Risikobetrachtung;;;;;;;;;;;;;;;;;;;;;;;;;;;;;;;
Investition;TL;1203;false;Übersetzungsfrage;residual value;net present value method;internal rate of return method;comparative profit method;payback method;comparative cost method;average return method;imputed interest;acquisition costs;imputed depreciation;;;;;;;;;;;3;1;2;5;7;4;6;10;8;9;;;;;;;;;;;Kapitalwertmethode;Interne Zinsfußmethode;Restwert;Kostenvergleichsrechnung;Gewinnvergleichsrechnung;Rentabilitätsrechnung;Amortisationsvergleichsrechnung;Anschaffungskosten;Kalkulatorische Abschreibung;Kalkulatorische Zinsen;;;;;;;;;;;;;;;;;;;;;;;;;;
ITIntro;SC;1204;false;Welche Aussage trifft auf digitale Informationen zu?;Sie können zu geringen Kosten ohne Integritätsverlust aufwändig dupliziert werden.;Sie können in kurzer Zeit ohne Qualitätsverlust einfach dupliziert werden.;Sie können zu geringen Kosten ohne Qualitätsverlust einfach dupliziert werden.;Sie können zu geringen Kosten ohne Qualitätsverlust einfach zerstört werden.;;;;;;;;;;;;;;;;;0;0;1;0;;;;;;;;;;;;;;;;;;;;;;;;;;;;;;;;;;;;;;;;;;;;;;;;;;;;
ITIntro;SC;1205;false;Wie ist Software am besten definiert?;Die Offlineversion einer Netzwerkressource.;Eine Sammlung von Algorithmen auf einem Computer.;Die Implementierung eines Programms in einer Laufzeitumgebung.;;;;;;;;;;;;;;;;;;0;0;1;;;;;;;;;;;;;;;;;;;;;;;;;;;;;;;;;;;;;;;;;;;;;;;;;;;;;
ITIntro;MC;1206;false;Welche Bestandteile enthält ein Softwareprodukt?;Code;Vertrag;Installations- und De-Installationsroutinen;Bilder, Klänge und Schriftarten;Hilfssystem / Anleitung;Rechnung;Diskette;Updatemethoden / Patches;Treiber für spezifische Hardware;;Aktivierungscode;;;;;;;;;;1;0;1;1;1;0;0;1;1;0;;;;;;;;;;;;;;;;;;;;;;;;;;;;;;;;;;;;;;;;;;;;;;
ITIntro;SC;1207;false;Wie viele natürliche Zahlen existieren in einem 32bit-System?;(32^2) - 1;2^32;32^2;(2^32) - 1;;;;;;;;;;;;;;;;;0;0;0;1;;;;;;;;;;;;;;;;;;;;;;;;;;;;;;;;;;;;;;;;;;;;;;;;;;;;
ITIntro;SC;1208;false;Was wird als Mantisse bezeichnet?;Die Potenz einer Gleitkommazahl nach den Ziffernstellen.;Die Ziffernstellen einer Gleitkommazahl vor der Potenz.;Der Logarithmus einer Gleitkommazahl bezogen auf die Potenz.;Die Stellen einer Gleitkommazahl vor dem Komma.;;;;;;;;;;;;;;;;;0;1;0;0;;;;;;;;;;;;;;;;;;;;;;;;;;;;;;;;;;;;;;;;;;;;;;;;;;;;
ITIntro;SC;1209;false;Sind Gleitkommazahlen fehleranfällig?;Ja, die Limitierung der Mantisse führt zu Präzisionsfehlern.;Ja, aber der Gleitkommaprozessor gleicht die Fehler der Potenz aus.;Ja, aber nur bei negativen Gleitkommazahlen durch die Nullstellenproblematik.;;;;;;;;;;;;;;;;;;1;0;0;;;;;;;;;;;;;;;;;;;;;;;;;;;;;;;;;;;;;;;;;;;;;;;;;;;;;
ITIntro;SC;1210;false;Wozu dient die Byte-Reihenfolge?;Sie legt fest, in welcher Reihenfolge Bytefolgen gespeichert werden.;Sie legt fest, in welcher Reihenfolge Byteabstände gelöscht werden.;Sie legt fest, in welcher Reihenfolge Bytefolgen verschlüsselt werden.;;;;;;;;;;;;;;;;;;1;0;0;;;;;;;;;;;;;;;;;;;;;;;;;;;;;;;;;;;;;;;;;;;;;;;;;;;;;
ITIntro;MC;1211;false;Welche Elemente sind Bestandteile einer Von-Neumann-Architektur?;Prozessor (CPU) mit Steuerwerk und Rechenwerk (ALU);Register;Hauptspeicher;Massenspeicher;I/O-Interface;Grafikeinheit;Netzwerkeinheit;Bus-System;;;;;;;;;;;;;1;0;1;0;1;0;0;1;;;;;;;;;;;;;;;;;;;;;;;;;;;;;;;;;;;;;;;;;;;;;;;;
ITIntro;DD;1212;false;Ordne diese typischen Operationen einer Von-Neumann-Architektur einander zu.;Stop;Summierung von Daten;Verschiebung von Daten zwischen Speicher, Prozessor und I/0;Vergleich von Daten;Multiplikation von Daten;Sprung zu neuer Instruktion;;;;;;;;;;;;;;;4;1;3;2;1;4;;;;;;;;;;;;;;;Arithmetische Operation;Logische Operation;Transportoperation;Verzweigung;;;;;;;;;;;;;;;;;;;;;;;;;;;;;;;;
ITIntro;MC;1213;false;Welche Datenkompressionsarten gibt es?;Verlustarme Datenkompression (Poor Lossless);Verlustbehaftete Datenkompression (Lossy);Verlustqualitative Datenkompression (Quality Lossy);Verlustsensitive Datenkompression (Sensitive Lossy);Verlustfreie Datenkompression (Lossless);Verlustreiche Datenkompression (Rich Lossless);;;;;;;;;;;;;;;0;1;0;0;1;0;;;;;;;;;;;;;;;;;;;;;;;;;;;;;;;;;;;;;;;;;;;;;;;;;;
ITIntro;SC;1214;false;Was ist ein Cache?;Die technische Bezeichnung für die Druckerwarteschlange.;Der Blockbereich eines Massenspeichers, der für die Verteilung von Prüfziffern zuständig ist.;Ein Puffer-Speicher, der zwischen Systemen mit unterschiedlicher Geschwindigkeit vermittelt.;Die Sicherheitsschaltung in einem Netzteil.;;;;;;;;;;;;;;;;;0;0;1;0;;;;;;;;;;;;;;;;;;;;;;;;;;;;;;;;;;;;;;;;;;;;;;;;;;;;
ITIntro;SC;1215;false;Was sind zeichenorientierte Geräte (character devices)?;Zeichenorientierte Geräte übertragen nur ein Zeichen zur selben Zeit. Ein Beispiel ist das Keyboard.;Zeichenorientierte Geräte sind Geräte zur Freihandgestaltung am Computer. Ein Beispiel ist der PC-Stift.;Zeichenorientierte Geräte übertragen Zeichen in Matrixform. Ein Beispiel ist eine Analog-Digital-Matrix.;;;;;;;;;;;;;;;;;;1;0;0;;;;;;;;;;;;;;;;;;;;;;;;;;;;;;;;;;;;;;;;;;;;;;;;;;;;;
ITIntro;TQ;1216;false;Was ist ein Algorithmus?;Eine endliche;;von genau definierten;;zur Erfüllung gleichartiger;;;.;;;;;;;;;;;;;;3;1;2;;;;;;;;;;;;;;;;;Aufgabe;Reihe;Anweisungen;;;;;;;;;;;;;;;;;;;;;;;;;;;;;;;;;
ITIntro;TQ;1217;false;Was macht die Pulse Code Modulation-Methode?;Sie wandelt ein zeit- und wertkontinuierliches;;Signal in ein zeit- und wertdiskretes;;Signal um.;;;;;;;;;;;;;;;;;2;1;;;;;;;;;;;;;;;;;;digitales;analoges;;;;;;;;;;;;;;;;;;;;;;;;;;;;;;;;;;
ITIntro;TL;1218;false;Ordne den deutschen Fachbegriffen ihre englischen Übersetzungen zu.;Character Device;Block Device;Mainboard;Runtime Environment;Mantissa;Cache;Floating Point Number;Source Code;Main Memory;Redundant Array of Independent Disks;;;;;;;;;;;3;6;1;4;5;7;9;10;8;2;;;;;;;;;;;Hauptplatine;Redundante Anordnung unabhängiger Festplatten;zeichenorientiertes Gerät;Laufzeitumgebung;Mantisse;blockorientiertes Gerät;Puffer-Speicher;Hauptspeicher;Gleitkommazahl;Quelltext;;;;;;;;;;;;;;;;;;;;;;;;;;
ITServiceManagement;MC;1219;false;Die Vorgehensweise von ITIL ist …;… technikorierntiert;… serviceorientiert;… prozessorientiert;… objektorientiert;;;;;;;;;;;;;;;;;0;1;1;0;;;;;;;;;;;;;;;;;;;;;;;;;;;;;;;;;;;;;;;;;;;;;;;;;;;;
ITServiceManagement;MC;1220;false;Welche Teilprozesse existieren im Capacity Management?;Business Capacity;Component Capacity;Service Capacity;Revenue Capacity;;;;;;;;;;;;;;;;;1;1;1;0;;;;;;;;;;;;;;;;;;;;;;;;;;;;;;;;;;;;;;;;;;;;;;;;;;;;
ITServiceManagement;SC;1221;false;Die Umsetzung von ITIL ist ein …;… De-facto-Standard;… De-jure-Standard;;;;;;;;;;;;;;;;;;;1;0;;;;;;;;;;;;;;;;;;;;;;;;;;;;;;;;;;;;;;;;;;;;;;;;;;;;;;
ITServiceManagement;SC;1222;false;Continual Service Improvement beschäftigt sich mit der Verbesserung der IT-Services.;Wahr;Falsch;;;;;;;;;;;;;;;;;;;0;1;;;;;;;;;;;;;;;;;;;;;;;;;;;;;;;;;;;;;;;;;;;;;;;;;;;;;;
ITServiceManagement;SC;1223;false;Welche Alternative zu ITIL kann genutzt werden?;COBIT;ITMS;IMBIT;EBIT;;;;;;;;;;;;;;;;;1;0;0;0;;;;;;;;;;;;;;;;;;;;;;;;;;;;;;;;;;;;;;;;;;;;;;;;;;;;
ITServiceManagement;SC;1224;false;Was bestimmt den Nutzen eines IT Services?;Service Entity & Timeframe;Availability, Warranty & Timeframe;Utility, Warranty & Cost;Cost, Utility & Availability;;;;;;;;;;;;;;;;;0;0;1;0;;;;;;;;;;;;;;;;;;;;;;;;;;;;;;;;;;;;;;;;;;;;;;;;;;;;
ITServiceManagement;SC;1225;false;Nach welchen Kriterien sollte man den Servicekatalog sortieren?;Technische Kriterien;Logistische Kriterien;Finanzielle Kriterien;Kunden Kriterien;;;;;;;;;;;;;;;;;0;0;0;1;;;;;;;;;;;;;;;;;;;;;;;;;;;;;;;;;;;;;;;;;;;;;;;;;;;;
ITServiceManagement;DD;1226;false;Ordne dem Process Owner und Process Manager die jeweiligen Aufgaben und Verantwortlichkeiten zu.;Prozessziele festlegen;Einhaltung von KPIs überwachen;Definition des Prozesses;Operative Ressourcenplanung;;;;;;;;;;;;;;;;;1;2;1;2;;;;;;;;;;;;;;;;;Process Owner;Process Manager;;;;;;;;;;;;;;;;;;;;;;;;;;;;;;;;;;
